<?xml version="1.0"?>
<!--
To change this license header, choose License Headers in Project Properties.
To change this template file, choose Tools | Templates
and open the template in the editor.
-->

<xs:schema version="1.0"
           xmlns:xs="http://www.w3.org/2001/XMLSchema"
           elementFormDefault="qualified">
    
    <xs:element name="horario">
        <xs:complexType>
            <xs:sequence>
                <xs:element name="modulos">
                    <xs:complexType>
                        <xs:sequence>
                            <xs:element name="modulo" maxOccurs="unbounded">
                                <xs:complexType>
                                    <xs:simpleContent>
                                        <xs:extension base="xs:string">
                                            <xs:attribute name="codM">
                                                <xs:simpleType>
                                                    <xs:restriction base="xs:ID">
                                                        <xs:enumeration value="EDD"/>
                                                        <xs:enumeration value="LMGSI"/>
                                                        <xs:enumeration value="PROG"/>
                                                        <xs:enumeration value="BBDD"/>
                                                        <xs:enumeration value="FOL"/>
                                                        <xs:enumeration value="SINF"/>
                                                    </xs:restriction>
                                                </xs:simpleType>
                                            </xs:attribute>
                                        </xs:extension>
                                    </xs:simpleContent>
                                </xs:complexType>
                            </xs:element>
                        </xs:sequence>
                    </xs:complexType>
                </xs:element>
                <xs:element name="profesores">
                    <xs:complexType>
                        <xs:sequence>
                            <xs:element name="profesor" maxOccurs="unbounded">
                                <xs:complexType>
                                    <xs:simpleContent>
                                        <xs:extension base="xs:string">
                                            <xs:attribute name="codP">
                                                <xs:simpleType>
                                                    <xs:restriction base="xs:ID">
                                                        <xs:pattern value="[A-Z]{3}"/>
                                                    </xs:restriction>
                                                </xs:simpleType>
                                            </xs:attribute>
                                        </xs:extension>
                                    </xs:simpleContent>
                                </xs:complexType>
                            </xs:element>
                        </xs:sequence>
                    </xs:complexType>
                </xs:element>
                <xs:element name="imparte">
                    <xs:complexType>
                        <xs:sequence>
                            <xs:element name="asignatura" maxOccurs="unbounded">
                                <xs:complexType>
                                    <xs:attribute name="codM" type="xs:IDREF"/>
                                    <xs:attribute name="codProfesor" type="xs:IDREF"/>
                                </xs:complexType>
                            </xs:element>
                        </xs:sequence>
                    </xs:complexType>
                </xs:element>
                <xs:element name="grupo">
                    <xs:complexType>
                        <xs:sequence>
                            <xs:element name="hora" maxOccurs="unbounded">
                                <xs:complexType>
                                    <xs:sequence>
                                        <xs:element name="dia_sem" maxOccurs="unbounded">
                                            <xs:complexType>
                                                <xs:simpleContent>
                                                    <xs:extension base="xs:string">
                                                        <xs:attribute name="dia">
                                                            <xs:simpleType>
                                                                <xs:restriction base="xs:string">
                                                                    <xs:enumeration value="lunes"/>
                                                                    <xs:enumeration value="martes"/>
                                                                    <xs:enumeration value="miercoles"/>
                                                                    <xs:enumeration value="jueves"/>
                                                                    <xs:enumeration value="viernes"/>
                                                                </xs:restriction>
                                                            </xs:simpleType>
                                                        </xs:attribute>
                                                        <xs:attribute name="num">
                                                            <xs:simpleType>
                                                                <xs:restriction base="xs:byte">
                                                                    <xs:enumeration value="1"/>
                                                                    <xs:enumeration value="2"/>
                                                                </xs:restriction>
                                                            </xs:simpleType>
                                                        </xs:attribute>
                                                    </xs:extension>
                                                </xs:simpleContent>
                                            </xs:complexType>
                                        </xs:element>
                                    </xs:sequence>
                                    <xs:attribute name="entrada" type="xs:time"/>
                                    <xs:attribute name="salida" type="xs:time"/>
                                </xs:complexType>
                            </xs:element>
                        </xs:sequence>
                        <xs:attribute name="idgrupo">
                            <xs:simpleType>
                                <xs:restriction base="xs:string">
                                    <xs:pattern value="[A-Z]{3}[0-9]"/>
                                </xs:restriction>
                            </xs:simpleType>
                        </xs:attribute>
                        <xs:attribute name="codT" type="xs:IDREF"/>
                    </xs:complexType>
                </xs:element>
            </xs:sequence>
            <xs:attribute name="curso"/>
        </xs:complexType>
    </xs:element>

</xs:schema>
